QuestionBody,AnswerBody,,
Can you explain what PyTorch is and its main uses in machine learning?,"PyTorch is an open-source machine learning library developed by Facebook's AI Research lab. It is widely used for applications such as natural language processing and computer vision. PyTorch offers dynamic computational graphs, which allow you to modify the graph on the go, making it very flexible and user-friendly.",,
What are tensors in PyTorch and why are they important?,Tensors are the primary data structures in PyTorch. They are multi-dimensional arrays similar to NumPy arrays but with additional capabilities for GPU acceleration. Tensors enable efficient computation and are essential for defining and training neural networks.,,
"How does PyTorch's dynamic computation graph work, and why is it beneficial?","PyTorch's dynamic computation graph, also known as define-by-run, allows the graph to be built on-the-fly as operations are executed. This means the graph is created during runtime, making it much easier to debug and modify compared to static computation graphs.",,
What is autograd in PyTorch and how does it simplify the training of neural networks?,"Autograd in PyTorch is an automatic differentiation library that records operations performed on tensors to create a computation graph. During the backward pass, autograd computes gradients automatically, simplifying the process of training neural networks.",,
How do you handle model evaluation in PyTorch?,"Model evaluation in PyTorch typically involves splitting the dataset into training, validation, and test sets. The model is trained on the training set, hyperparameters are tuned using the validation set, and the final evaluation is performed on the test set. Metrics such as accuracy, precision, recall, and F1 score can be used to quantify performance.",,
"What are some common challenges you might face when using PyTorch, and how do you overcome them?","Common challenges with PyTorch include dealing with complex data preprocessing, managing GPU memory efficiently, and debugging dynamic graphs. Overcoming these challenges often involves using PyTorch's extensive libraries and tools, following best practices for memory management, and leveraging the vibrant community for support.",,
"How does PyTorch facilitate transfer learning, and why is it useful?","Transfer learning in PyTorch is facilitated through pre-trained models available in libraries like Torchvision. Transfer learning allows you to leverage pre-trained models on large datasets and fine-tune them for specific tasks, significantly reducing training time and improving performance.",,
How do you manage data preprocessing in PyTorch before feeding it into a model?,"Data preprocessing in PyTorch typically involves steps like normalization, augmentation, and transformation. You can use tools like torchvision.transforms for common image transformations or write custom transformations for specific needs.",,
Explain how to implement and use batch normalization in PyTorch.,"Batch normalization is implemented using torch.nn.BatchNorm2d for 2D data like images. It normalizes the inputs for each mini-batch, which helps in stabilizing the learning process and speeding up the training.",,
"What is the role of the optimizer in PyTorch, and how do you choose one?","The optimizer in PyTorch is used to update the model parameters based on the computed gradients. Popular optimizers include SGD, Adam, and RMSprop, each with its own advantages.",,
 How do you handle missing or corrupted data when training a model in PyTorch?, How do you handle missing or corrupted data when training a model in PyTorch?,,
 How do you handle missing or corrupted data when training a model in PyTorch?,"Model performance in PyTorch can be evaluated using metrics like accuracy, precision, recall, and F1 score. torchmetrics library can be used to simplify this process.",,
Explain the concept of weight initialization in PyTorch and its significance.,Weight initialization is the process of setting the initial values of weights in a neural network before training begins. Proper initialization can help in faster convergence and avoid issues like vanishing or exploding gradients.,,
How do you implement early stopping in PyTorch to prevent overfitting?,"Early stopping is a technique used to halt training when the validation performance starts to deteriorate, indicating overfitting. This can be implemented in PyTorch by monitoring the validation loss during training and stopping when certain criteria are met.",,
Can you describe how you would handle an imbalanced dataset in PyTorch?,"Handling imbalanced datasets can involve techniques like resampling (oversampling minority class or undersampling majority class), using different loss functions, or applying data augmentation.",,
What steps do you follow to deploy a PyTorch model in production?,"Deploying a PyTorch model involves steps like model serialization using torch.save and torch.load, converting the model into a format suitable for inference (like TorchScript), and setting up an inference server using frameworks like Flask or FastAPI.",,
How do you approach hyperparameter tuning in PyTorch?,"Hyperparameter tuning can be done using techniques like grid search, random search, or more sophisticated approaches like Bayesian optimization. Libraries like Optuna can be used to facilitate this process.",,
Can you explain the role of the TorchScript in PyTorch?,TorchScript is a way to create serializable and optimizable models from PyTorch code. It allows models to be exported from Python runtime into a format that can be run independently from Python. This is particularly useful for deploying models in production environments where Python may not be available or desired.,,
What is the significance of the PyTorch library's modular design?,"PyTorch's modular design means that it is built with a flexible and modular approach, allowing users to pick and choose components as needed. This makes it highly adaptable to various use cases, whether it's for research-oriented tasks or production-grade applications.",,
How does PyTorch's ecosystem support model deployment?,"PyTorch offers several tools and libraries that facilitate model deployment. For example, TorchServe is a flexible and easy-to-use tool for serving PyTorch models in production. It supports multi-model serving, logging, metrics, and more.",,
Can you explain the role of the DataLoader class in PyTorch?,"The DataLoader class in PyTorch is essential for loading data in a way that's efficient and convenient. It provides functionalities like batching, shuffling, and parallel data loading, which are crucial for training large-scale models efficiently.",,
How does PyTorch handle multi-GPU training?,"PyTorch provides multiple ways to perform multi-GPU training, such as DataParallel and DistributedDataParallel. DataParallel is the simpler of the two and allows for easy parallelization over multiple GPUs by splitting the input data and performing computations across GPUs in parallel.",,
What is the purpose of the nn.functional module in PyTorch?,"The nn.functional module in PyTorch provides a variety of functions that are used to construct neural network layers. This includes operations like convolutions, activations, and loss functions, among others.",,
How does PyTorch facilitate debugging compared to other frameworks?,"PyTorch's dynamic computation graph, also known as define-by-run, makes debugging much more intuitive compared to static graph frameworks. This allows you to use standard Python debugging tools, such as pdb or PyCharm's debugger, directly within your model code.",,
Can you explain the importance of the autograd engine in PyTorch?,"The autograd engine in PyTorch is a powerful feature that automatically computes the gradients needed for backpropagation. This is crucial for training neural networks, as it simplifies the process by eliminating the need for manual gradient calculations.",,
How would you approach building a custom dataset for a unique image classification problem where labeled data is scarce?,"1. Data augmentation: Applying transformations like rotations, flips, and color jittering to existing images to artificially expand the dataset.\n2. Transfer learning: Utilizing pre-trained models on larger datasets and fine-tuning them for the specific problem.\n3. Semi-supervised learning: Leveraging a small amount of labeled data along with a larger pool of unlabeled data.\n4. Synthetic data generation: Creating artificial images that mimic the characteristics of the target dataset.\n5. Active learning: Iteratively selecting the most informative samples for labeling to maximize the value of limited labeling resources.",,
Imagine you're working on a PyTorch model that's taking an unusually long time to train. How would you go about optimizing the training process?,"1.    Profiling: Using PyTorch's built-in profiler to identify bottlenecks in the code.\n2.    Data loading: Optimizing the DataLoader by increasing num_workers, using pin_memory=True for GPU training, and considering dataset caching.\n3.    Model architecture: Simplifying the model if possible, or using more efficient architectures.\n4.    Batch size: Experimenting with larger batch sizes (if memory allows) to leverage GPU parallelism.\n5.    Mixed precision training: Utilizing float16 along with float32 to speed up computations on compatible GPUs.\n6.    Gradient accumulation: For handling larger effective batch sizes with limited memory.\n7.    Distributed training: Leveraging multiple GPUs or machines if available.",,
You're tasked with deploying a PyTorch model for real-time inference in a production environment. What considerations would you keep in mind?,"Model optimization: Converting the model to TorchScript for better performance and portability.\nHardware selection: Choosing appropriate hardware (CPU, GPU, or specialized accelerators) based on latency and throughput requirements.\nServing framework: Selecting a suitable serving framework like TorchServe or ONNX Runtime.\nScalability: Implementing load balancing and auto-scaling to handle varying traffic.\nMonitoring: Setting up logging and monitoring for model performance and system health.\nVersioning: Implementing a system for model versioning and easy rollbacks.\nInput/Output processing: Ensuring efficient pre-processing and post-processing pipelines.\nSecurity: Implementing measures to protect the model and data.",,
How would you approach implementing a custom loss function in PyTorch for a regression task where outliers should be penalized less severely?,"Subclass nn.Module: Create a custom loss function by subclassing nn.Module.\nImplement the forward method: Define the computation of the loss in the forward method.\nChoose an appropriate function: Select a function that grows more slowly for large errors, such as Huber loss or log-cosh loss.\nParameterization: Include parameters that control the point at which the loss transitions from quadratic to linear behavior.\nTesting: Implement unit tests to verify the loss function behaves as expected for various inputs.",,
"In a PyTorch project, you notice that your model's performance on the validation set is significantly worse than on the training set. How would you diagnose and address this issue?",Identify overfitting: Recognize that the performance discrepancy likely indicates overfitting.\nAnalyze learning curves: Plot training and validation loss over epochs to visualize the divergence point.\nData augmentation: Implement or increase data augmentation to improve generalization.\nRegularization: Add or increase regularization techniques like L1/L2 regularization or dropout.\nSimplify model: Consider reducing model complexity if it's too powerful for the dataset.\nEarly stopping: Implement early stopping to prevent overfitting during training.\nCross-validation: Use k-fold cross-validation to ensure the issue isn't due to an unrepresentative validation set.\nEnsemble methods: Consider ensemble techniques to improve generalization.,,
